<?xml version="1.0" encoding="UTF-8"?>
<!DOCTYPE listafacturas PUBLIC "public-id" "exercise.dtd">
<listafacturas>
	<facturas fecha="hello">
		<emisor cif="77777777">
			<nombre></nombre>
			<volumenventas></volumenventas>
		</emisor>
		<pagador cif="7777777777">
			<nombre></nombre>
			<volumenventas></volumenventas>
		</pagador>
		<importe></importe>
	</facturas>
</listafacturas>